id,试卷名称,试题简介,word2vec
0,第1节　长度和时间的测量,(柳州中考)一个中学生的身高约为(),"[0.030937873758375645,-0.20446800347417593,0.07760335924103856,0.05660174344666302,0.021415553288534284]"
1,第1节　长度和时间的测量,下列长度单位换算正确的是(),"[-0.07923593744635582,-0.26820977265015244,-0.04264575755223632,-0.14990293351002038,0.08549118041992188]"
2,第1节　长度和时间的测量,"初中生小红想对比测量一个月前后自己的身高变化,选用下列哪种尺最合适()","[-0.008039933629333973,-0.20343961799517274,-0.061635409540031105,0.011067528743296862,0.048510019201785326]"
3,第1节　长度和时间的测量,如图所示测量木块长度的方法中正确的是(),"[-0.04186457809474733,-0.3207453654872046,0.020535511792533927,-0.09134323359467089,0.054709450652201966]"
4,第1节　长度和时间的测量,下列各个过程中经历的时间最接近1秒的是(),"[-0.16658607125282288,-0.22331467063890562,-0.10715015242911047,-0.07162313970426717,-0.05355645529925823]"
5,第1节　长度和时间的测量,"物理实验室中,常用的测量时间的工具是()","[-0.1145541225042608,-0.28111989920337993,0.03263080896188815,0.05825662468042638,-0.10512936746494637]"
6,第1节　长度和时间的测量,"图为小组同学学习长度测量后讨论交流的情境,下列关于误差说法中正确的是()","[-0.06380619015544653,-0.10921565662412082,-0.08515838719904423,-0.10575387358446331,0.16362768740338438]"
7,第1节　长度和时间的测量,"在测量物体长度时,由于下列原因造成测量结果有差异,其中属于误差的是()","[-0.0024713375023566186,-0.2880229090806097,0.029552251507993788,-0.1278037322917953,0.027972720185061917]"
8,第1节　长度和时间的测量,下列估计的数据与实际最接近的是(),"[-0.05363944050623104,-0.20332191372290254,-0.09954494680278003,-0.05793931649532169,0.020806896733120084]"
9,第1节　长度和时间的测量,"某同学测得物理课本长为25.91 cm,宽为18.35 cm,那么他所用刻度尺的分度值为()","[-0.03149333760580596,-0.16228996345992475,-0.05427236197625889,0.07370095300104688,-0.03387911886195926]"
10,第1节　长度和时间的测量,"(北京中考)中华人民共和国的国旗为长方形五星红旗,如图是天安门广场升旗仪式的场景,根据图片提供的信息估测...","[0.008726959655943669,-0.11691483691653334,-0.024455385454195108,0.013015435861521645,0.02463424784180365]"
11,第2节　运动的描述,"机械运动是自然界最普遍的一种运动,如图所示的各种运动中,不属于机械运动的是()","[-0.07137719665964444,-0.2175891905790195,-0.02635846558647851,-0.08576013481554885,0.10869659749247754]"
12,第2节　运动的描述,"关于参照物,下列说法正确的是()","[-0.15798095613718033,0.0064018639469785345,-0.4088452053921563,-0.25555263300027165,0.4551608268105026]"
13,第2节　运动的描述,"(长春中考)端午节当天,小明和爸爸、妈妈去南湖游玩,他们坐在行驶的船中,观赏南湖的景色,小明认为爸爸是运动...","[-0.014927923679351807,-0.13416751044463704,0.015181950801475483,0.009352362884039228,0.078839165518399]"
14,第2节　运动的描述,"(益阳中考)某大学两位研究生从蚂蚁身上得到启示,设计出如图所示的“都市蚂蚁”概念车.这款概念车...","[0.011173274237846366,-0.032579822882421706,-0.021068468444833628,-0.01485707520164157,0.032677236589063935]"
15,第2节　运动的描述,"关于运动和静止,下列说法正确的是()","[-0.19553663535043597,-0.18619387090438977,-0.29769546538591385,-0.3303601685911417,0.38570668682223186]"
16,第2节　运动的描述,下列说法正确的是(),"[-0.23100816607475283,-0.017105744127184155,-0.4745137304067612,-0.2738962382078171,0.4875912194605917]"
17,第2节　运动的描述,"(郴州中考)你也许有过这样的体验:甲、乙两列火车并排停在站台上,你坐在甲车车厢向乙车车厢观望,如图所示,突...","[0.033054079837165774,-0.14443868931848555,0.04304350810125471,0.01897470531985164,0.1048135367105715]"
18,第2节　运动的描述,"(武汉中考)2017年4月22日,天舟一号货运飞船与天宫二号空间实验室首次完成自动交会对接,如图所示,“天...","[-0.028162203950896147,-0.06444794615908038,-0.015922651537472292,0.0680332811815398,0.10927153318022777]"
19,第1节　长度和时间的测量,在下列数据后填上合适的单位. (1)教室的长度约为850_______ (2)一根头发的直径约为70_______,"[-0.0016514589352642787,-0.13779536470332565,0.09474086739561137,-0.0756986298433998,-0.035705049467437404]"
20,第1节　长度和时间的测量,"(株洲中考)图中刻度尺的分度值_______mm,木条的长度为_______cm.","[0.02438712745372738,-0.22017324077231543,0.03584589410041059,-0.019337683051292385,0.03365535355572189]"
21,第1节　长度和时间的测量,"市场上有一款PM2.5检测仪,它可测量空气中直径范围为0.3~2.5 μm的颗粒物浓度,即它可测出最小直径为_______m...","[0.017819871939718724,-0.12207303303293884,0.03450720871333033,-0.1126884189900011,-0.08993335366249085]"
22,第1节　长度和时间的测量,"(贵港中考)如图1所示,所测物体的长度是_______cm.如图2所示,停表显示的时间是_______s.","[-0.07285928922808832,-0.22607758765419322,-0.025558137024442353,0.06190392426732513,-0.029698704679807026]"
23,第1节　长度和时间的测量,"如图所示,用A、B两把刻度尺测量同一物体的长度,准确程度较高的是_______刻度尺,最接近物体长度真实值的读数...","[-0.01353734340518713,-0.2848009620909579,0.10046459513250738,-0.08831207524053752,-0.044908609334379436]"
24,第1节　长度和时间的测量,"同一长度的五次测量结果记录为:25.1 mm,25.2 mm,25.1 mm,27.2 mm,25.3 mm,其中记录明显错误的一次是_______...","[0.014391203969717025,-0.15086703397333623,0.03209467811509967,-0.02118400178849697,0.06571967668831348]"
25,第2节　运动的描述,"公路上飞驰而过的汽车、水里游动的鱼、天空飞翔的雄鹰,它们的位置都发生了_______物理学中称这种现象为____...","[0.007427665223884913,-0.0537755125357459,0.06236404139134619,-0.049392579433818654,0.15139102613708624]"
26,第2节　运动的描述,"在商场里,妈妈和5岁的小东正乘自动扶梯下楼.小东拉着妈妈的手说:“妈妈,我们跑下去吧!”妈妈说:&...","[0.04995307120095406,-0.18029350857250392,0.023763226478227546,-0.016111787275544232,0.08835426922554948]"
27,第2节　运动的描述,"(攀枝花中考)小华和妈妈在仁和区湿地公园骑双人自行车游玩,小华认为自己是静止的,他是以_______为参照物,但...","[0.02586400283402518,-0.12248607641576151,0.021245126612484455,-0.047652330886768665,0.06710585063372396]"
28,第2节　运动的描述,"“枯藤老树昏鸦,小桥流水人家”给人冷落暗淡的气氛,又显示出一种清新幽静的境界.如图所示,&ldquo...","[0.008335504862342906,-0.0780948289012646,-0.021247837993809405,0.006605442175093819,0.07285363669507205]"
29,第2节　运动的描述,"随着城市建设的加快,城市交通大为改善.在南京“中山北路”平直的快车道上,有三辆汽车正同向顺风...","[0.017878414235181276,-0.059047448862757944,0.10042964153560913,-0.03379974695336487,0.009020781949705754]"
30,第2节　运动的描述,"小明喜欢打篮球,更喜欢观看电视转播的CBA比赛.他发现:运动员始终处于电视屏幕上,但我们却感觉运动员在球场...","[0.030433929432183506,-0.023836665763519706,0.011891186470165849,0.04264466390013695,0.11166163022862748]"
31,第2节　运动的描述,"如图所示为学校运动会接力赛交接棒情景,小铭同学发现在4×100 m 的接力赛交接棒的过程中有两种交接方式: 第...","[-0.00849772938527167,-0.0285198142984882,-0.07535914103500546,0.03894959827885032,0.06008444981416688]"
32,章末复习,"(泉州中考)小蒋同学参加中考体育测试,结果最可能达到的是()","[0.10333740940460792,0.04284180643466803,-0.007964749104128435,0.17943339809202233,0.113350085555934]"
33,章末复习,"如图是用厚刻度尺测量木块的长度,其中正确的测量图是()","[0.020738148892467674,-0.16546923463994806,0.007894948802211067,-0.0012285845692862165,0.093125341121446]"
34,章末复习,"(扬州中考)如图所示,菲菲和翔翔坐在车厢内,观察判断火车的运动情况.菲菲:以窗外的动车为参照物,火车的位置...","[0.06508065655361861,-0.0145788359164726,-0.010690035577863456,0.08963719634339214,0.15815393034135924]"
35,章末复习,"(淮安中考)周末,小明乘坐“今世缘”号有轨电车去周恩来纪念馆参观,在有轨电车行驶过程中,小明觉...","[0.03326410333187703,0.0033591274747296293,-0.022758228676941463,0.10257288684849353,0.0378965666408048]"
36,章末复习,"(成都中考改编)小李每天坚持用“微信运动”来统计当天行走的步数,如图为她在6月12日的步行情况....","[0.0011137667063035462,-0.04459277560052118,0.004437055438756943,0.1421371335898967,0.06010363352681069]"
37,章末复习,"(河北中考)平直公路上并排停放着两辆汽车,一段时间后,坐在甲车上的小明感觉乙车向北运动,关于两辆汽车的运...","[-0.02368568323020424,-0.14963798153968083,0.22626155455197605,0.030888654912511505,0.1748639016434373]"
38,章末复习,(黄石中考)湖北省第十四届中学生运动会于5月17至27日在秀美山水宜居名城——湖北·黄石成功举行.在百...,"[0.010660593839068162,0.03273284827408038,0.03214247392392472,0.11212679474173406,0.13871534259401652]"
39,章末复习,"(咸宁中考)如图是某物体做直线运动时的路程随时间变化的图象,由图象判断下列说法错误的是()","[-0.13414965814445168,-0.02269653885741718,-0.20425213174894452,-0.02389929088531062,0.19178689795080572]"
40,第3节　运动的快慢,"观看百米赛跑时运动员们到达终点前,观众判断谁跑得快的根据是()","[0.03419528901576996,-0.1948144208978523,-0.027434175326065586,-0.0009574646299535578,0.1196388101670891]"
41,第3节　运动的快慢,"(湖州中考)下列体育项目中,以“速度”这一物理量作为评定标准的是()","[0.03109585342463106,-0.09009815480870505,-0.039809445336383455,0.014742824248969555,0.07280679852313672]"
42,第3节　运动的快慢,"空中加油机给战斗机进行加油,如果战斗机在加油时,2 s内飞行了0.4 km.则在加油时,空中加油机的速度为()","[0.05316271539777517,-0.11935829919050721,0.061587212223778755,-0.02878508382641217,0.03823839121169465]"
43,第3节　运动的快慢,"现在陆地上跑得最快的动物是猎豹,在水中游得最快的动物是旗鱼,在空中飞得最快的动物是褐海燕,如图所示是三...","[0.009260227643501233,-0.08175959429868004,0.0023113171953488797,0.03047402504393283,0.011668098638491595]"
44,第3节　运动的快慢,下列物体的运动可近似看作匀速直线运动的是(),"[-0.04916899961729844,-0.3255799752142694,0.0024251648121409943,-0.1401409858630763,0.009383138708977235]"
45,第3节　运动的快慢,"(天门中考)关于平均速度,下列叙述中错误的是()","[-0.045475820596847266,-0.13759867495132816,-0.15166087285615504,-0.21559706019858518,0.2254886787333008]"
46,第3节　运动的快慢,"如图记录了甲、乙两辆汽车在平直公路上行驶时,在某段时间内的运动过程.关于甲、乙两车的运动情况,说法错误...","[-0.09075281190636911,-0.18787991608444013,-0.04586530786840931,-0.13015022462135867,0.13714568357375498]"
47,2019级16班物理第一周错题,"初中生小红想对比测量一个月前后自己的身高变化,选用下列哪种尺最合适()","[-0.03580479323863983,-0.16822373908427027,-0.1284787258029812,0.02147898583724681,0.03216089577310615]"
48,2019级16班物理第一周错题,下列各个过程中经历的时间最接近1秒的是(),"[-0.1831929074092345,-0.1620750410312956,-0.20825471669774165,-0.03955154292370108,-0.061752025545998054]"
49,2019级16班物理第一周错题,"如图所示,用A、B两把刻度尺测量同一物体的长度,准确程度较高的是_______刻度尺,最接近物体长度真实值的读数...","[-0.03575428219681436,-0.24859148442787543,0.031038245038044726,-0.07075910089241172,-0.04979256227273833]"
50,2019级16班物理第一周错题,"(贵港中考)如图1所示,所测物体的长度是_______cm.如图2所示,停表显示的时间是_______s.","[-0.09136572731658817,-0.19211949966847897,-0.08932484891265631,0.06619059609947726,-0.03659204337745905]"
51,2019级16班物理第一周错题,"市场上有一款PM2.5检测仪,它可测量空气中直径范围为0.3~2.5 μm的颗粒物浓度,即它可测出最小直径为_______m...","[-0.007247722792354497,-0.1006570034660399,-0.028923015343025327,-0.09291941339192404,-0.09072414802556689]"
52,2019级16班物理第一周错题,"如图所示为学校运动会接力赛交接棒情景,小铭同学发现在4×100 m 的接力赛交接棒的过程中有两种交接方式: 第...","[-0.027566563054595303,-0.0488620534863161,-0.09559517706056003,0.05144043820505233,0.01246543981782768]"
53,2019级16班物理第一周错题,"随着城市建设的加快,城市交通大为改善.在南京“中山北路”平直的快车道上,有三辆汽车正同向顺风...","[-0.006774519348428362,-0.07696595351167378,0.05315368075943774,-0.009726539620065262,-0.03583856216088558]"
54,2019级16班物理第一周错题,"小明喜欢打篮球,更喜欢观看电视转播的CBA比赛.他发现:运动员始终处于电视屏幕上,但我们却感觉运动员在球场...","[0.006287053308409193,-0.044789750412430454,-0.01972532705606326,0.05465353874530157,0.05731516191735864]"
55,2019级16班物理第一周错题,"在商场里,妈妈和5岁的小东正乘自动扶梯下楼.小东拉着妈妈的手说:“妈妈,我们跑下去吧!”妈妈说:&...","[0.01383921378018225,-0.18103176848415065,-0.02110712241162272,0.010504299487151644,0.01893975815790541]"
56,2019级16班物理第一周错题,"公路上飞驰而过的汽车、水里游动的鱼、天空飞翔的雄鹰,它们的位置都发生了_______物理学中称这种现象为____...","[-0.015732304215253817,-0.07244715094566345,0.02052602349292664,-0.023091824603311363,0.08619307571401198]"
57,第3节　运动的快慢,"(哈尔滨中考)百米赛跑时,甲、乙运动员从同一起跑线同时起跑,某时刻位置如图所示,可知运动较快的_______,你...","[0.04154052574406652,-0.09518257156014442,0.01420703308437677,-0.004526964498355108,0.08891416173976134]"
58,第3节　运动的快慢,"一辆汽车做匀速直线运动的速度为15 m/s,读作_______,其物理意义是_______若汽车上的速度表如图所示,则汽车...","[-0.0034646629873249265,-0.21115658721990055,0.21122416952210996,-0.01125042699277401,-0.011059924468605055]"
59,第3节　运动的快慢,(武汉中考)2017年举行的武汉马拉松吸引了两万多名国内外选手参赛.如图为选手们通过建成通车60周年的武汉长...,"[-0.15088946630500935,0.1916597448712723,-0.12146470488303088,0.1202910071323541,0.4502792061539367]"
60,第3节　运动的快慢,"《校车驾驶员安全管理规定》中明确指出车速不得超过40 km/h,“40 km/h”是指校车在行驶过程中的_...","[0.07114741715945695,-0.13242544139441298,-0.001427234273011747,-0.025665710876254657,0.02725486577439465]"
61,第3节　运动的快慢,"(营口中考)一架战斗机巡航的速度为500 m/s,合_______km/h.军演地点距军用机场的距离为3 600 km,则战斗机从...","[0.08095517166351017,-0.09086144343018532,0.039735606038256696,-0.0037814082675858545,0.0593518714150904]"
62,第3节　运动的快慢,"(无锡中考)小明想测量无锡地铁的运行速度.他测得地铁从堰桥站出发到达锡北运河站所用时间为2 min,在手机中...","[0.011301224962586448,-0.20030819411788667,0.06676078895993885,0.06818080897487344,0.014336776775529697]"
63,第3节　运动的快慢,"(聊城中考)暑假,家住聊城的小明准备乘坐Z308次列车去北京参加青少年夏令营,该车经停车站的信息如下表所示,...","[0.08989027785983952,-0.10346246483756907,0.0003198821266943758,0.010972183155403896,0.08048282365780324]"
64,第3节　运动的快慢,"“五一”劳动节期间,小明一家开车外出旅游,途中看到如图所示的限速牌.小明用了10 min的时间通过...","[-0.01674489628057927,-0.08173556933179499,0.018843157123774292,0.08818941761273891,0.06706164436182008]"
65,第3节　运动的快慢,"(德阳中考)某艘船在静水中的速度为6 m/s,现在它在水流速度为2 m/s的河中逆流行驶,在经过一座桥时掉落了一只...","[0.11723718453982943,-0.1013695193748725,0.012355938455776164,0.0520094694373639,0.05224489562801624]"
66,09月17日物理课堂练习101长度时间测量,"(2019新疆建设兵团)北京天安门广场升国旗时,护旗队员每一步行进的距离是( )","[-0.26357487068675894,-0.23101514555952127,0.17187197155812206,0.060740198775687634,-0.09264706064234761]"
67,09月17日物理课堂练习101长度时间测量,下列有关长度的测量说法错误的是( ),"[-0.4222004658409527,-0.27357937954366207,0.08230605136070933,0.01976084183635456,0.06295938151223318]"
68,09月17日物理课堂练习101长度时间测量,"下列数值中,单位应该是厘米的是( )","[-0.34655270266991395,-0.27449695228670656,0.18827061312129864,0.17596920071026453,-0.13239303331535596]"
69,09月17日物理课堂练习101长度时间测量,"下列对时间和长度的估测,其中最接近实际的是( )","[-0.3302102961577475,-0.3099791494508584,0.1656897202755014,0.11743705800424019,-0.09100955824057261]"
70,09月17日物理课堂练习101长度时间测量,"下列估测的数据中,最接近实际的是( )","[-0.39147054386110264,-0.2598711352508802,0.14446076585982856,0.16727613120411453,-0.11852720451469606]"
71,09月17日物理课堂练习101长度时间测量,"如图,停表的读数是mins;","[-0.4856140036135912,-0.31276789121329784,0.24381722509860992,0.23590380395762622,-0.17147803003899753]"
72,09月17日物理课堂练习101长度时间测量,"如图所示,用刻度尺测量物体的长度,读数时视线正确的是  (填“A”或“B”),测出该物体...","[-0.26109158728075654,-0.3089092334634379,0.1669758125453403,0.07183059035359245,-0.08154528156707161]"
73,09月17日物理课堂练习101长度时间测量,"体育课测验跳远,用皮卷尺测得某同学的跳远成绩为1.22m,由此可知,皮卷尺的分度值为 dm,其中准确值是  m,估读...","[-0.12900328015287715,-0.13805888996769983,0.13291552552470454,0.08506319559765635,-0.03792470797068543]"
74,09月17日物理课堂练习101长度时间测量,"一位同学用刻度尺5次测得某物体的长度分别是:10.42cm、10.21cm、10.43cm、10.44cm、10.43cm,这 些数据中,错...","[-0.15048266126325835,-0.2097774124531834,0.04640294583859267,0.12285777129646804,-0.08941361425375496]"
75,09月17日物理课堂练习101长度时间测量,"如图所示,用A、B 两刻度尺测一木块的边长,就工具的分度值而言,  (填字母)刻度尺精密些;就使 用方法而言,  (...","[-0.19535986694972962,-0.22401830266145142,0.14694236337461256,0.10815879100383344,-0.07309654554013502]"
76,09月17日物理课堂练习101长度时间测量,下列长度的单位换算正确的是( ),"[-0.3905279567608467,-0.30206464546231127,0.17881099736461273,0.10900577601905054,-0.0556194567336486]"
77,09月17日物理课堂练习101长度时间测量,下列刻度尺的使用方法中正确的是(  ),"[-0.40405801339791375,-0.26521382108330727,0.12758289678738668,0.13418062172758466,-0.07933874242007732]"
78,09月17日物理课堂练习101长度时间测量,"用塑料卷尺测量长度时,若用力拉尺进行测量,那么由此可能引起测量结果(  )","[-0.1982888520949266,-0.29594933260655537,0.1661924811672758,0.0666395368647169,-0.09533811203966087]"
79,09月17日物理课堂练习101长度时间测量,"用分度值是1mm 的尺子去测量一支铅笔的直径,下面是几个同学的记录,其中错误的是( )","[-0.2056135745009496,-0.22733457439712115,0.11164424127145182,0.049394044980761546,-0.06092353927947226]"
80,09月17日物理课堂练习101长度时间测量,"下列关于误差和错误的说法,正确的是(  )","[-0.4068858850348208,-0.14390069751867227,0.029128404068095342,-0.008679923135787249,0.17607023606875113]"
81,09月17日物理课堂练习101长度时间测量,"某同学进行测量记录时因粗心漏掉了单位,请你补上:物理教科书的长度为26  ,课桌的宽度为 0.65  .","[-0.20883908146061003,-0.20881101242654646,0.12689661296705404,0.12347996362950653,-0.10121671692468226]"
82,09月17日物理课堂练习101长度时间测量,"如图1所示,物体的长度是  cm.如图所示,使用厚刻度尺测量物体的长度时,符合要求的是  图,写出与图2相对应的...","[-0.2218070823861205,-0.2970514461074186,0.13536378716968972,0.10928104659947364,-0.10303257804606919]"
83,09月17日物理课堂练习101长度时间测量,"在一条长绳的一端系一个小铁块就做成了一个摆,要测出它摆动一个来回所用的时间(周期: T),方法是 :用秒表测...","[-0.16753315385431053,-0.1340589015185833,0.16032068924978377,0.0799049975257367,-0.12530943237245082]"
84,09月17日物理课堂练习102运动的描述,下列运动不属于机械运动的是(  ),"[-0.48625848306850955,-0.333987387786196,0.12892707979137247,0.14154957234859467,-0.023646535648202356]"
85,09月17日物理课堂练习102运动的描述,"国产歼—15舰载机从航空母舰“辽宁号”上起飞,如图所示,若说该飞机上的飞行员 是静止的,所...","[-0.2609530710097816,-0.2334284296311024,0.11529338595250414,0.1649176056186358,-0.010266527417115867]"
86,09月17日物理课堂练习102运动的描述,"(2019自贡)鲁迅的«社戏»中有这样的描写:“淡黑的起伏的连山,仿佛是踊跃的铁的兽脊似的,都...","[-0.15922935471116076,-0.2067667048734923,0.08342432769547616,0.05884203097472588,-0.037584302558874086]"
87,09月17日物理课堂练习102运动的描述,"我国高铁以高速、平稳、安全著称.在高速行驶的复兴号上,某乘客看到一枚立着的硬币保持数分钟静止 不动.乘客...","[-0.0864769690311872,-0.1800625767164792,0.0907259790513378,0.0847457131335082,0.031204897614840705]"
88,09月17日物理课堂练习102运动的描述,"关于运动和静止,下列说法错误的是(  )","[-0.4329748506156298,-0.2616563322237478,0.002833103331235739,0.004836132893195519,0.1483636392781941]"
89,09月17日物理课堂练习102运动的描述,"关于机械运动的概念,下列说法错误的是(   )","[-0.39688205898094636,-0.14280137194033998,-0.037556047622974105,0.08436430990695953,0.16269469517283142]"
90,09月17日物理课堂练习102运动的描述,"看电视转播的百米赛跑时,我们常常感觉运动员跑得很快,但实际上他们始终在屏幕内,我们认为运动员 是运动的,...","[-0.1417382787913084,-0.167561212129405,0.14169453452948644,0.1067009037360549,0.04099877707093306]"
91,09月17日物理课堂练习102运动的描述,"空中飞翔的鸟对飞机构成了巨大威胁,鸟与飞机相撞引起机毁人亡的原因是(  )","[-0.16733111568579548,-0.2028847829144644,0.11249154610069174,0.14470670764383517,0.011173075935068099]"
92,09月17日物理课堂练习102运动的描述,"(2019武昌模拟)2019年4月14日,武汉马拉松赛激情开跑,这是武汉一次重大的体育赛事,向世界展示 了一个生态、...","[-0.19819567350670697,-0.08637774424627423,0.06995185047388076,0.09325049392879009,0.04250633340328932]"
93,09月17日物理课堂练习102运动的描述,"(2019大冶期末)歌词“小小竹排江中游,巍巍青山两岸走”,前句描述的运动物体和后一 句的参照物分...","[-0.12027801929608635,-0.25688670628258714,0.07227099184756694,0.069170196581146,0.04544897258038754]"
94,09月17日物理课堂练习102运动的描述,"(2019新疆建设兵团)2019年1月3日,我国“嫦娥四号”探测器在月球背面成功着陆,标志着我国探月工 ...","[-0.11754108254205098,-0.2602833447850902,0.04283151335336945,0.0876291935459118,0.01858100548005578]"
95,09月17日物理课堂练习102运动的描述,"某次奥运圣火传递活动中,现场某记者同时拍下了固定在地面上随风飘动的旗帜和 附近的甲、乙两火炬照片,如图...","[-0.1348155887797475,-0.13997779147699477,0.06469438157975674,0.11114916786551476,0.060087251579388976]"
96,09月18日物理课堂练习103,"一个正在做匀速直线运动的物体,关于v=s/t,下列说法正确的是(  )","[-0.3454055127554706,-0.16640467649059634,0.08693016772823674,0.05534556295190538,0.12502151107349033]"
97,09月18日物理课堂练习103,"陈老师喜爱绕白云湖行走,通过手机软件测得四十分钟行走6000步,路程约4km.据此估计他行走的平 均速度和一步...","[-0.029633730565282432,-0.26097971734336833,0.1270789987915619,0.15560552901165053,0.053531808630478656]"
98,09月18日物理课堂练习103,下面的成语中与物理学中描述运动快慢的方法最相近的是(  ),"[-0.3092782486659976,-0.3183611335698515,0.17833872626607236,0.09144738626379807,-0.06739110465591344]"
99,09月18日物理课堂练习103,"一辆正在高速公路上行驶的汽车,其速度表如图所示,指针显示汽车速度为  km/h,合  m/s.","[-0.21190369852325494,-0.23515209095442996,0.3440500689013039,0.16339169864487998,-0.06223599788020639]"
